{
    "$schema": "../../vinv-tuple.json",
    "v": "0.0.1-alpha.0",
    "created": "2018-11-13T20:20:39+00:00",
    "id": "550e8400-e29b-11d4-a716-446655440000",
    "inventory": {
        "tree_status":{
            "a8efa695-b151-4238-baa2-9ed888ca340f":[
                [[23.4444441,23.4444441], 12],
                "34_",
                23,12, 
                [[0.5,5], [0.3,5]],
                [[0.3,5], [0.6,5]],
                "2018-11-13",
                null
            ],
            "6f832609-288d-44ba-8057-00b9e105f0d4":[
                [[23.4444441,23.4444441, 0], 12],
                "34_",
                23,
                12, 
                [[0.3,5], [0.6,5]],
                [[0.3,5], [0.6,5]],
                "2018-11-13",
                null
            ]
        },
        "tree_history": [
            [
                "a8efa695-b151-4238-baa2-9ed888ca340f",
                "2018-11-13T20:20:39+00:00",
                [
                    [[23.4444441,23.4444441], 12],
                    "34_",
                    19,12, 
                    [[0.5,5], [0.3,5]],
                    [[0.3,5], [0.6,5]],
                    "2018-11-13",
                    null
                ]
            ],
            [
                "a8efa695-b151-4238-baa2-9ed888ca340f",
                "2020-10-05T20:20:39+00:00",
                [
                    [[23.4444441,23.4444441], 12],
                    "34_",
                    23,12, 
                    [[0.5,5], [0.3,5]],
                    [[0.3,5], [0.6,5]],
                    "2018-11-13",
                    null
                ]
            ]
        ]
    }
}